<?xml version="1.0" encoding="UTF-8"?>
<pennterest xmlns:xsi="http://www.w3.org/2001/XMLSchema-instance" xsi:noNamespaceSchemaLocation="pennterest.xsd">
  <operator>Group TBD</operator>
  <web_url>www.shanjoshandreimainak.com</web_url>
  <object>
    <id>1</id>
    <source>TBD</source>
    <type>photo</type>
    <url>http://www.dartfrogforums.com/images/tinc_540x350_1.jpg</url>
    <tag>animals</tag>
  </object>
  <object>
    <id>2</id>
    <source>TBD</source>
    <type>photo</type>
    <url>http://images2.fanpop.com/images/photos/6900000/Felines-national-geographic-6909274-1024-768.jpg</url>
    <tag>animals</tag>
  </object>
  <object>
    <id>3</id>
    <source>TBD</source>
    <type>photo</type>
    <url>http://eofdreams.com/data_images/dreams/tiger/tiger-02.jpg</url>
    <tag>animals</tag>
  </object>
  <object>
    <id>4</id>
    <source>TBD</source>
    <type>photo</type>
    <url>http://images.nationalgeographic.com/wpf/media-live/photos/000/004/cache/african-lion-male_436_600x450.jpg</url>
    <tag>animals</tag>
  </object>
  <object>
    <id>5</id>
    <source>TBD</source>
    <type>photo</type>
    <url>http://3.bp.blogspot.com/-X4MTSOjPWXg/T6Nqf6MvcgI/AAAAAAAABHU/GDusB_R3OtM/s1600/mountain+Zebras+babies+of+beautifull+dangerous+animals.jpg</url>
  </object>
  <object>
    <id>6</id>
    <source>TBD</source>
    <type>photo</type>
    <url>http://eofdreams.com/data_images/dreams/tiger/tiger-02.jpg</url>
  </object>
  <object>
    <id>7</id>
    <source>TBD</source>
    <type>photo</type>
    <url>http://images.nationalgeographic.com/wpf/media-live/photos/000/004/cache/african-lion-male_436_600x450.jpg</url>
  </object>
  <object>
    <id>8</id>
    <source>TBD</source>
    <type>photo</type>
    <url>http://images.nationalgeographic.com/wpf/media-live/photos/000/006/cache/leopard_606_600x450.jpg</url>
  </object>
  <object>
    <id>9</id>
    <source>TBD</source>
    <type>photo</type>
    <url>http://www.dartfrogforums.com/images/tinc_540x350_1.jpg</url>
  </object>
  <object>
    <id>10</id>
    <source>TBD</source>
    <type>pdf</type>
    <url>http://www.tldp.org/LDP/intro-linux/intro-linux.pdf</url>
    <tag>computers</tag>
  </object>
  <object>
    <id>11</id>
    <source>TBD</source>
    <type>pdf</type>
    <url>http://linux-training.be/files/books/LinuxFun.pdf</url>
    <tag>linux</tag>
  </object>
  <user>
    <login>tom.cruise@gmail.com</login>
    <email>tom.cruise@gmail.com</email>
    <givenname>Tom</givenname>
    <surname>Cruise</surname>
    <affiliation>Hollywood Actor</affiliation>
    <birthday>1990-12-12</birthday>
    <interests>Baseball</interests>
    <interests>Basketball</interests>
    <interests>Hockey</interests>
    <friend>bill.gates@gmail.com</friend>
    <board>
      <name>Hello World</name>
    </board>
    <board>
      <name>Hello America</name>
    </board>
    <board>
      <name>New Delhi</name>
    </board>
    <pin>
      <objectId>1</objectId>
      <sourceId>TBD</sourceId>
      <board>New Delhi</board>
    </pin>
    <rating>
      <objectId>1</objectId>
      <sourceId>TBD</sourceId>
      <rating>5</rating>
    </rating>
  </user>
  <user>
    <login>amitabh.bacchan@gmail.com</login>
    <email>amitabh.bacchan@gmail.com</email>
    <givenname>Amitabh </givenname>
    <surname>Bacchan</surname>
    <affiliation>Bollywood Actor</affiliation>
    <birthday>1990-12-12</birthday>
    <interests>Baseball</interests>
    <friend>tom.cruise@gmail.com</friend>
    <board>
      <name>Hello World</name>
    </board>
    <pin>
      <objectId>2</objectId>
      <sourceId>TBD</sourceId>
      <board>Hello World</board>
    </pin>
  </user>
  <user>
    <login>arvind.kejriwal@gmail.com</login>
    <email>arvind.kejriwal@gmail.com</email>
    <givenname>Arvind</givenname>
    <surname>Kejriwal</surname>
    <affiliation>Indian Politician</affiliation>
    <birthday>1990-12-12</birthday>
    <friend>manmohan.singh@gmail.com</friend>
    <board>
      <name>Indian Outlook</name>
    </board>
    <pin>
      <objectId>3</objectId>
      <sourceId>TBD</sourceId>
      <board>Indian Outlook</board>
    </pin>
  </user>
  <user>
    <login>stephen.fry@gmail.com</login>
    <email>stephen.fry@gmail.com</email>
    <givenname>Stephen</givenname>
    <surname>Fry</surname>
    <affiliation>British Presenter</affiliation>
    <birthday>1990-12-12</birthday>
    <friend>sachin.tendulkar@gmail.com</friend>
    <board>
      <name>Industrial Revolution</name>
    </board>
    <pin>
      <objectId>4</objectId>
      <sourceId>TBD</sourceId>
      <board>Industrial Revolution</board>
    </pin>
    <rating>
      <objectId>2</objectId>
      <sourceId>TBD</sourceId>
      <rating>5</rating>
    </rating>
    <rating>
      <objectId>3</objectId>
      <sourceId>TBD</sourceId>
      <rating>1</rating>
    </rating>
  </user>
  <user>
    <login>shahrukh.khan@gmail.com</login>
    <email>shahrukh.khan@gmail.com</email>
    <givenname>Shahrukh</givenname>
    <surname>Khan</surname>
    <affiliation>Bollywood Actor</affiliation>
    <birthday>1990-12-12</birthday>
    <board>
      <name>Philadelphia</name>
    </board>
  </user>
  <user>
    <login>jennifer.lawrence@gmail.com</login>
    <email>jennifer.lawrence@gmail.com</email>
    <givenname>Jennifer</givenname>
    <surname>Lawrence</surname>
    <affiliation>Hollywood Actor</affiliation>
    <birthday>1990-12-12</birthday>
    <board>
      <name>New York</name>
    </board>
    <pin>
      <objectId>4</objectId>
      <sourceId>TBD</sourceId>
      <board>New York</board>
    </pin>
  </user>
  <user>
    <login>zach.ives@gmail.com</login>
    <email>zach.ives@gmail.com</email>
    <givenname>Zach</givenname>
    <surname>Ives</surname>
    <affiliation>UPenn Professor</affiliation>
    <birthday>1990-12-12</birthday>
    <friend>bill.gates@gmail.com</friend>
    <board>
      <name>The American Dream</name>
    </board>
    <rating>
      <objectId>7</objectId>
      <sourceId>TBD</sourceId>
      <rating>2</rating>
    </rating>
  </user>
  <user>
    <login>charlie.chaplin@gmail.com</login>
    <email>charlie.chaplin@gmail.com</email>
    <givenname>Charlie </givenname>
    <surname>Chaplin</surname>
    <affiliation>Comedian</affiliation>
    <birthday>1990-12-12</birthday>
    <interests>Computers</interests>
    <friend>bill.gates@gmail.com</friend>
    <board>
      <name>Computer Technology</name>
    </board>
    <board>
      <name>Change the World</name>
    </board>
    <board>
      <name>World Today</name>
    </board>
  </user>
  <user>
    <login>george.bush@gmail.com</login>
    <email>george.bush@gmail.com</email>
    <givenname>George</givenname>
    <surname>Bush</surname>
    <affiliation>US Politician</affiliation>
    <birthday>1990-12-12</birthday>
    <board>
      <name>Economics</name>
    </board>
  </user>
  <user>
    <login>jason.statham@gmail.com</login>
    <email>jason.statham@gmail.com</email>
    <givenname>Jason</givenname>
    <surname>Statham</surname>
    <affiliation>Hollywood Actor</affiliation>
    <birthday>1990-12-12</birthday>
    <board>
      <name>Facebook</name>
    </board>
    <rating>
      <objectId>10</objectId>
      <sourceId>TBD</sourceId>
      <rating>4</rating>
    </rating>
  </user>
  <user>
    <login>sachin.tendulkar@gmail.com</login>
    <email>sachin.tendulkar@gmail.com</email>
    <givenname>Sachin</givenname>
    <surname>Tendular</surname>
    <affiliation>Indian Cricketer</affiliation>
    <birthday>1990-12-12</birthday>
    <board>
      <name>Amazon Shopping</name>
    </board>
    <rating>
      <objectId>6</objectId>
      <sourceId>TBD</sourceId>
      <rating>2</rating>
    </rating>
  </user>
  <user>
    <login>bill.gates@gmail.com</login>
    <email>bill.gates@gmail.com</email>
    <givenname>Bill</givenname>
    <surname>Gates</surname>
    <affiliation>Programming Whiz</affiliation>
    <birthday>1990-12-12</birthday>
    <interests>Phones</interests>
    <board>
      <name>Programming 101</name>
    </board>
    <board>
      <name>Google Hangouts</name>
    </board>
    <rating>
      <objectId>4</objectId>
      <sourceId>TBD</sourceId>
      <rating>1</rating>
    </rating>
  </user>
  <user>
    <login>manmohan.singh@gmail.com</login>
    <email>manmohan.singh@gmail.com</email>
    <givenname>Manmohan</givenname>
    <surname>Singh</surname>
    <affiliation>Indian Politician</affiliation>
    <birthday>1990-12-12</birthday>
    <board>
      <name>Ebay</name>
    </board>
  </user>
</pennterest>